[
  {
    "id": "BASE-001",
    "phase": "Cross-Phase",
    "requirement": "Capture baseline metadata (repo SHA, timestamp, environment).",
    "type": "baseline",
    "source": "git + runtime environment",
    "passRule": "Baseline metadata is captured in verification output.",
    "failSeverity": "p1"
  },
  {
    "id": "BASE-002",
    "phase": "Cross-Phase",
    "requirement": "Capture raw evidence for required repository files.",
    "type": "baseline",
    "source": "help-topics.ts, help-system.md, package.json, ci.yml, ci-cd.md",
    "passRule": "All required evidence files are present and fingerprinted.",
    "failSeverity": "p1"
  },
  {
    "id": "GOV-001",
    "phase": "Cross-Phase",
    "requirement": "Required Help Center labels exist exactly.",
    "type": "governance",
    "source": "GitHub labels",
    "passRule": "All required labels are present: area:help-center, phase:1..7, type:epic|feature|qa|chore, priority:p1|p2, north-star.",
    "failSeverity": "p1"
  },
  {
    "id": "GOV-002",
    "phase": "Cross-Phase",
    "requirement": "Milestones HC-P1 through HC-P7 exist.",
    "type": "governance",
    "source": "GitHub milestones",
    "passRule": "Milestone titles include HC-P1, HC-P2, HC-P3, HC-P4, HC-P5, HC-P6, HC-P7.",
    "failSeverity": "p1"
  },
  {
    "id": "GOV-003",
    "phase": "Cross-Phase",
    "requirement": "Each HC milestone has exactly 5 issues (1 epic + 4 non-epic).",
    "type": "governance",
    "source": "GitHub issues by milestone",
    "passRule": "For every HC milestone, issue count is 5 and epic count is 1.",
    "failSeverity": "p1"
  },
  {
    "id": "GOV-004",
    "phase": "Cross-Phase",
    "requirement": "All HC milestones are closed after completion.",
    "type": "governance",
    "source": "GitHub milestone states",
    "passRule": "All milestones HC-P1..HC-P7 are state=closed.",
    "failSeverity": "p1"
  },
  {
    "id": "GOV-005",
    "phase": "Cross-Phase",
    "requirement": "At most one HC milestone is active during rollout.",
    "type": "governance",
    "source": "GitHub milestone states",
    "passRule": "Open HC milestones are <= 1.",
    "failSeverity": "p1"
  },
  {
    "id": "GOV-006",
    "phase": "Cross-Phase",
    "requirement": "Closed HC issues have acceptance checklists checked.",
    "type": "governance",
    "source": "GitHub issue body",
    "passRule": "Closed HC issues contain checklist entries and all are checked.",
    "failSeverity": "p1"
  },
  {
    "id": "GOV-007",
    "phase": "Cross-Phase",
    "requirement": "Closed HC issues have linked PR closure evidence.",
    "type": "governance",
    "source": "GitHub closedByPullRequestsReferences",
    "passRule": "Every closed HC issue has at least one closing PR reference.",
    "failSeverity": "p1"
  },
  {
    "id": "CON-001",
    "phase": "Cross-Phase",
    "requirement": "HelpTopic includes audience, journeyStep, keywords, outcomes fields.",
    "type": "contract",
    "source": "apps/renderer/src/features/help/help-topics.ts",
    "passRule": "HelpTopic type includes audience, journeyStep, keywords, outcomes.",
    "failSeverity": "p1"
  },
  {
    "id": "CON-002",
    "phase": "Cross-Phase",
    "requirement": "buildHelpHashPath supports topic, anchor, q, context in the payload contract.",
    "type": "contract",
    "source": "apps/renderer/src/features/help/help-topics.ts",
    "passRule": "buildHelpHashPath payload type includes topic, anchor, q, context.",
    "failSeverity": "p1"
  },
  {
    "id": "CON-003",
    "phase": "Cross-Phase",
    "requirement": "buildHelpHashPath encodes q and context query params.",
    "type": "contract",
    "source": "apps/renderer/src/features/help/help-topics.ts",
    "passRule": "buildHelpHashPath sets q and context in URLSearchParams when present.",
    "failSeverity": "p1"
  },
  {
    "id": "CON-004",
    "phase": "Cross-Phase",
    "requirement": "HelpDefinition type exists in renderer help domain.",
    "type": "contract",
    "source": "apps/renderer/src/features/help/**/*",
    "passRule": "A HelpDefinition type or interface exists with id, term, meaning, appliesTo, relatedTopicId.",
    "failSeverity": "p1"
  },
  {
    "id": "CON-005",
    "phase": "Cross-Phase",
    "requirement": "package.json defines check:help-integrity script.",
    "type": "contract",
    "source": "package.json",
    "passRule": "scripts.check:help-integrity is defined.",
    "failSeverity": "p1"
  },
  {
    "id": "CON-006",
    "phase": "Cross-Phase",
    "requirement": "check:help-integrity points to scripts/check-help-integrity.cjs.",
    "type": "contract",
    "source": "package.json",
    "passRule": "scripts.check:help-integrity invokes node scripts/check-help-integrity.cjs.",
    "failSeverity": "p1"
  },
  {
    "id": "CON-007",
    "phase": "Cross-Phase",
    "requirement": "scripts/check-help-integrity.cjs exists.",
    "type": "contract",
    "source": "scripts/check-help-integrity.cjs",
    "passRule": "scripts/check-help-integrity.cjs exists on disk.",
    "failSeverity": "p1"
  },
  {
    "id": "CON-008",
    "phase": "Cross-Phase",
    "requirement": "CI executes npm run check:help-integrity.",
    "type": "contract",
    "source": ".github/workflows/ci.yml",
    "passRule": "ci.yml contains a step running npm run check:help-integrity.",
    "failSeverity": "p1"
  },
  {
    "id": "CON-009",
    "phase": "Cross-Phase",
    "requirement": "Branch protection on main requires Help Integrity status check.",
    "type": "contract",
    "source": "GitHub branch protection",
    "passRule": "main branch protection required status checks include Help Integrity.",
    "failSeverity": "p1"
  },
  {
    "id": "BEH-001",
    "phase": "Cross-Phase",
    "requirement": "Current integrity check command passes on repository state.",
    "type": "behavior",
    "source": "cmd /c npm run help:check",
    "passRule": "Command exits zero.",
    "failSeverity": "p1"
  },
  {
    "id": "BEH-002",
    "phase": "Cross-Phase",
    "requirement": "Help-related renderer tests pass.",
    "type": "behavior",
    "source": "cmd /c npm run test --workspace @budgetit/renderer -- <help-related tests>",
    "passRule": "HelpPage, ImportPage, ReportsPage, and DashboardPage tests all pass.",
    "failSeverity": "p1"
  },
  {
    "id": "BEH-003",
    "phase": "Cross-Phase",
    "requirement": "Negative check: missing heading scenario fails integrity command with actionable output.",
    "type": "behavior",
    "source": "temp workspace mutation + node scripts/help-tools.cjs check",
    "passRule": "Mutated missing-heading scenario exits non-zero and output is actionable.",
    "failSeverity": "p1"
  },
  {
    "id": "BEH-004",
    "phase": "Cross-Phase",
    "requirement": "Negative check: duplicate heading edge-case scenario fails integrity command.",
    "type": "behavior",
    "source": "temp workspace mutation + node scripts/help-tools.cjs check",
    "passRule": "Duplicate-heading edge-case exits non-zero.",
    "failSeverity": "p1"
  },
  {
    "id": "BEH-005",
    "phase": "Cross-Phase",
    "requirement": "Negative check: stale generated output drift fails integrity command.",
    "type": "behavior",
    "source": "temp workspace mutation + node scripts/help-tools.cjs check",
    "passRule": "Drift mutation exits non-zero with stale generation guidance.",
    "failSeverity": "p1"
  },
  {
    "id": "NS-001",
    "phase": "Cross-Phase",
    "requirement": "North-star scenario for brand-new users is documented with six outcomes.",
    "type": "north-star",
    "source": "docs/help/north-star-acceptance.md",
    "passRule": "Document includes all six new-user outcomes.",
    "failSeverity": "p2"
  },
  {
    "id": "NS-002",
    "phase": "Cross-Phase",
    "requirement": "North-star scenario for experienced users includes F1/search/context under 30 seconds.",
    "type": "north-star",
    "source": "docs/help/north-star-acceptance.md",
    "passRule": "Document includes F1 + search/jump + meaning retrieval under 30s.",
    "failSeverity": "p2"
  },
  {
    "id": "PH1-1",
    "phase": "HC-P1",
    "requirement": "EPIC: HC-P1 Information Architecture and Coverage Map",
    "type": "phase-item",
    "source": "GitHub issue + milestone HC-P1",
    "passRule": "Issue with exact title exists in HC-P1 and has verifiable implementation evidence.",
    "failSeverity": "p1"
  },
  {
    "id": "PH1-2",
    "phase": "HC-P1",
    "requirement": "Create north-star coverage matrix (user goal -> help topic -> anchor)",
    "type": "phase-item",
    "source": "GitHub issue + docs/help artifacts",
    "passRule": "Issue with exact title exists in HC-P1 and has verifiable implementation evidence.",
    "failSeverity": "p1"
  },
  {
    "id": "PH1-3",
    "phase": "HC-P1",
    "requirement": "Refactor help topic metadata model for audience/journey tagging",
    "type": "phase-item",
    "source": "GitHub issue + help-topics metadata",
    "passRule": "Issue with exact title exists in HC-P1 and has verifiable implementation evidence.",
    "failSeverity": "p1"
  },
  {
    "id": "PH1-4",
    "phase": "HC-P1",
    "requirement": "Add Help Center \"Start Here\" entry IA (new user path + experienced user path)",
    "type": "phase-item",
    "source": "GitHub issue + help UI content",
    "passRule": "Issue with exact title exists in HC-P1 and has verifiable implementation evidence.",
    "failSeverity": "p1"
  },
  {
    "id": "PH1-5",
    "phase": "HC-P1",
    "requirement": "QA gate: every primary route has mapped help entry and valid jump target",
    "type": "phase-item",
    "source": "GitHub issue + route/help tests",
    "passRule": "Issue with exact title exists in HC-P1 and has verifiable implementation evidence.",
    "failSeverity": "p1"
  },
  {
    "id": "PH2-1",
    "phase": "HC-P2",
    "requirement": "EPIC: HC-P2 Baseline Setup Journey",
    "type": "phase-item",
    "source": "GitHub issue + milestone HC-P2",